{
  "id": "su-ki-hong",
  "title": "四季紅",
  "subtitle": "Sù-kì-hông (7030 / 1=Eb 4/4 ♩=120)",
  "catalogNumber": "7030",
  "lyricist": "李臨秋 (Lí Lîm-chhiu)",
  "composer": "鄧雨賢 (Tēng Ú-hiân)",
  "notator": "數位簡譜採譜排版",
  "key": "Eb",
  "timeSignature": "4/4",
  "bpm": 120,
  "notesPerLine": 4,
  "verseCount": 4,
  "description": "1938年臺灣經典歌謠《四季紅》（李臨秋作詞、鄧雨賢作曲），Eb調 (4/4拍，♩=120)。標準簡譜排版，包含完整前奏（第1-8小節）、四季主歌（春、夏、秋、冬）、第1.3.反覆跳越間奏、第2.跳越 8Bars 間奏與第4.尾奏 (Coda)。",
  "footnote": "音圓點歌號 7030 / 音域 3. ~ 6. / 原作詞 李臨秋・作曲 鄧雨賢",
  "measures": [
    {
      "id": "skh_m1",
      "measureNumber": 1,
      "chord": "Eb",
      "section": "前奏 (Prelude)",
      "isPrelude": true,
      "notes": [
        {
          "id": "skh_n1_1",
          "pitch": 5,
          "octave": 0,
          "duration": 0.75,
          "isDotted": true,
          "lyric": {}
        },
        {
          "id": "skh_n1_2",
          "pitch": 6,
          "octave": 0,
          "duration": 0.25,
          "lyric": {}
        },
        {
          "id": "skh_n1_3",
          "pitch": 1,
          "octave": 1,
          "duration": 0.5,
          "lyric": {}
        },
        {
          "id": "skh_n1_4",
          "pitch": 6,
          "octave": 0,
          "duration": 0.5,
          "lyric": {}
        },
        {
          "id": "skh_n1_5",
          "pitch": 1,
          "octave": 1,
          "duration": 0.5,
          "lyric": {}
        },
        {
          "id": "skh_n1_6",
          "pitch": 1,
          "octave": 1,
          "duration": 0.25,
          "lyric": {}
        },
        {
          "id": "skh_n1_7",
          "pitch": 6,
          "octave": 0,
          "duration": 0.25,
          "lyric": {}
        },
        {
          "id": "skh_n1_8",
          "pitch": 1,
          "octave": 1,
          "duration": 1,
          "lyric": {}
        }
      ]
    },
    {
      "id": "skh_m2",
      "measureNumber": 2,
      "chord": "Eb",
      "isPrelude": true,
      "notes": [
        {
          "id": "skh_n2_1",
          "pitch": 5,
          "octave": 0,
          "duration": 0.75,
          "isDotted": true,
          "lyric": {}
        },
        {
          "id": "skh_n2_2",
          "pitch": 6,
          "octave": 0,
          "duration": 0.25,
          "lyric": {}
        },
        {
          "id": "skh_n2_3",
          "pitch": 1,
          "octave": 1,
          "duration": 0.5,
          "lyric": {}
        },
        {
          "id": "skh_n2_4",
          "pitch": 6,
          "octave": 0,
          "duration": 0.5,
          "lyric": {}
        },
        {
          "id": "skh_n2_5",
          "pitch": 5,
          "octave": 0,
          "duration": 2,
          "lyric": {}
        }
      ]
    },
    {
      "id": "skh_m3",
      "measureNumber": 3,
      "chord": "Eb",
      "isPrelude": true,
      "isLineBreak": true,
      "notes": [
        {
          "id": "skh_n3_1",
          "pitch": 5,
          "octave": 0,
          "duration": 0.75,
          "isDotted": true,
          "lyric": {}
        },
        {
          "id": "skh_n3_2",
          "pitch": 6,
          "octave": 0,
          "duration": 0.25,
          "lyric": {}
        },
        {
          "id": "skh_n3_3",
          "pitch": 5,
          "octave": 0,
          "duration": 0.5,
          "lyric": {}
        },
        {
          "id": "skh_n3_4",
          "pitch": 6,
          "octave": 0,
          "duration": 0.5,
          "lyric": {}
        },
        {
          "id": "skh_n3_5",
          "pitch": 1,
          "octave": 1,
          "duration": 0.5,
          "lyric": {}
        },
        {
          "id": "skh_n3_6",
          "pitch": 1,
          "octave": 1,
          "duration": 0.25,
          "lyric": {}
        },
        {
          "id": "skh_n3_7",
          "pitch": 6,
          "octave": 0,
          "duration": 0.25,
          "lyric": {}
        },
        {
          "id": "skh_n3_8",
          "pitch": 1,
          "octave": 1,
          "duration": 1,
          "lyric": {}
        }
      ]
    },
    {
      "id": "skh_m4",
      "measureNumber": 4,
      "chord": "Eb",
      "isPrelude": true,
      "notes": [
        {
          "id": "skh_n4_1",
          "pitch": 5,
          "octave": 1,
          "duration": 0.5,
          "lyric": {}
        },
        {
          "id": "skh_n4_2",
          "pitch": 5,
          "octave": 1,
          "duration": 0.5,
          "lyric": {}
        },
        {
          "id": "skh_n4_3",
          "pitch": 5,
          "octave": 1,
          "duration": 0.5,
          "slurToNext": true,
          "lyric": {}
        },
        {
          "id": "skh_n4_4",
          "pitch": 2,
          "octave": 1,
          "duration": 0.25,
          "slurToNext": true,
          "lyric": {}
        },
        {
          "id": "skh_n4_5",
          "pitch": 3,
          "octave": 1,
          "duration": 0.25,
          "lyric": {}
        },
        {
          "id": "skh_n4_6",
          "pitch": 1,
          "octave": 1,
          "duration": 2,
          "lyric": {}
        }
      ]
    },
    {
      "id": "skh_m5",
      "measureNumber": 5,
      "chord": "Eb",
      "isPrelude": true,
      "notes": [
        {
          "id": "skh_n5_1",
          "pitch": 1,
          "octave": 1,
          "duration": 0.5,
          "lyric": {}
        },
        {
          "id": "skh_n5_2",
          "pitch": 1,
          "octave": 1,
          "duration": 0.25,
          "lyric": {}
        },
        {
          "id": "skh_n5_3",
          "pitch": 2,
          "octave": 1,
          "duration": 0.25,
          "lyric": {}
        },
        {
          "id": "skh_n5_4",
          "pitch": 1,
          "octave": 1,
          "duration": 0.5,
          "lyric": {}
        },
        {
          "id": "skh_n5_5",
          "pitch": 6,
          "octave": 0,
          "duration": 0.5,
          "lyric": {}
        },
        {
          "id": "skh_n5_6",
          "pitch": 5,
          "octave": 0,
          "duration": 0.5,
          "lyric": {}
        },
        {
          "id": "skh_n5_7",
          "pitch": 5,
          "octave": 0,
          "duration": 0.25,
          "lyric": {}
        },
        {
          "id": "skh_n5_8",
          "pitch": 3,
          "octave": 0,
          "duration": 0.25,
          "lyric": {}
        },
        {
          "id": "skh_n5_9",
          "pitch": 5,
          "octave": 0,
          "duration": 0.5,
          "lyric": {}
        },
        {
          "id": "skh_n5_10",
          "pitch": 6,
          "octave": 0,
          "duration": 0.5,
          "lyric": {}
        }
      ]
    },
    {
      "id": "skh_m6",
      "measureNumber": 6,
      "chord": "Bb7",
      "isPrelude": true,
      "isLineBreak": true,
      "notes": [
        {
          "id": "skh_n6_1",
          "pitch": 1,
          "octave": 1,
          "duration": 0.5,
          "lyric": {}
        },
        {
          "id": "skh_n6_2",
          "pitch": 1,
          "octave": 1,
          "duration": 0.25,
          "lyric": {}
        },
        {
          "id": "skh_n6_3",
          "pitch": 2,
          "octave": 1,
          "duration": 0.25,
          "lyric": {}
        },
        {
          "id": "skh_n6_4",
          "pitch": 1,
          "octave": 1,
          "duration": 0.5,
          "lyric": {}
        },
        {
          "id": "skh_n6_5",
          "pitch": 6,
          "octave": 0,
          "duration": 0.5,
          "lyric": {}
        },
        {
          "id": "skh_n6_6",
          "pitch": 5,
          "octave": 0,
          "duration": 2,
          "lyric": {}
        }
      ]
    },
    {
      "id": "skh_m7",
      "measureNumber": 7,
      "chord": "Eb",
      "isPrelude": true,
      "notes": [
        {
          "id": "skh_n7_1",
          "pitch": 2,
          "octave": 1,
          "duration": 0.25,
          "lyric": {}
        },
        {
          "id": "skh_n7_2",
          "pitch": 5,
          "octave": 1,
          "duration": 0.25,
          "lyric": {}
        },
        {
          "id": "skh_n7_3",
          "pitch": 3,
          "octave": 1,
          "duration": 0.25,
          "lyric": {}
        },
        {
          "id": "skh_n7_4",
          "pitch": 5,
          "octave": 1,
          "duration": 0.25,
          "lyric": {}
        },
        {
          "id": "skh_n7_5",
          "pitch": 2,
          "octave": 1,
          "duration": 0.5,
          "lyric": {}
        },
        {
          "id": "skh_n7_6",
          "pitch": 5,
          "octave": 1,
          "duration": 0.5,
          "lyric": {}
        },
        {
          "id": "skh_n7_7",
          "pitch": 2,
          "octave": 1,
          "duration": 0.25,
          "lyric": {}
        },
        {
          "id": "skh_n7_8",
          "pitch": 3,
          "octave": 1,
          "duration": 0.25,
          "lyric": {}
        },
        {
          "id": "skh_n7_9",
          "pitch": 5,
          "octave": 1,
          "duration": 0.25,
          "lyric": {}
        },
        {
          "id": "skh_n7_10",
          "pitch": 6,
          "octave": 1,
          "duration": 0.25,
          "lyric": {}
        },
        {
          "id": "skh_n7_11",
          "pitch": 5,
          "octave": 1,
          "duration": 0.5,
          "lyric": {}
        },
        {
          "id": "skh_n7_12",
          "pitch": 3,
          "octave": 1,
          "duration": 0.5,
          "lyric": {}
        }
      ]
    },
    {
      "id": "skh_m8",
      "measureNumber": 8,
      "chord": "Bb7",
      "isPrelude": true,
      "barlineType": "repeat_start",
      "notes": [
        {
          "id": "skh_n8_1",
          "pitch": 5,
          "octave": 1,
          "duration": 0.25,
          "lyric": {}
        },
        {
          "id": "skh_n8_2",
          "pitch": 6,
          "octave": 1,
          "duration": 0.25,
          "lyric": {}